Rating,Date,Review
5,2020-09-05,Great candle. They packaged the candle extremely well. Nice fragrance.
5,2020-02-16,If you love Yankee candles they are perfect
5,2022-06-07,Great scent always on sale
5,2020-11-14,Came well packaged.  Great scent
5,2021-01-15,I’ve had This kind before they are awesome. Great scent and lasts a long time.
5,2020-01-22,I love Pink Sands..my favorite scent from Yankee Candle
5,2020-02-05,"Very nice smell, and these candles last a long time"
5,2020-05-12,My favorite scent and wonderful value
5,2020-07-20,I love this!
5,2018-02-07,"Super sweet and tart, my boyfriend loves it, I will definitely keep this one stocked. I don’t get much lavender from it but that’s ok, it reminds me of candy."
5,2011-04-23,I bought this candle for my sister-in-law's wedding and put in the gift bag at her shower. She had it out and lit in her bridal suite while we all got ready for the wedding. It smelled great(mild) and looked so pretty. A really nice gift for a bride to be or a wedding anniversary.
5,2019-04-26,"Burns great. Scent like a bouquet of Roses. Delivered with protective packing, absolutely love it."
5,2021-09-21,My absolute favorite scent.  Yankee Candles are just the best.
5,2020-05-09,"Thank you  One of my all time favorite candle.! Arrived unbroken, packaged well ."
5,2020-06-11,The best frangrance EVER!!
5,2019-09-18,My fav scent and the last a long time. Deff get them before they r sold ouy
5,2017-03-21,I love the scent of this candle on days when I can open a window and door. It enhances those delicious smells from the outside garden.
5,2020-01-30,Just love the smell so much soft yet fills the room
5,2018-02-04,I purchased the large Gardenia jar candle.  It's very fragrant but not overpowering and clean burning.  Cap it with the lid to put it out and there's no smoking.
5,2020-02-13,"The scent is divine, not overpowering at all."
5,2021-06-24,"fast shipping, good quality"
5,2019-06-24,my favorite scent EVER. just burns quick! OR I USE IT TOO MUCH/almost gone already
5,2019-01-08,This candle smelt my apartment up so quick and smells amazing. Mostly fruity and sweet to me.  Will purchase again.
5,2020-05-17,Love the candle love the scent thank u
5,2020-01-22,Bought as a gift Yankee candles are the Best
5,2021-09-15,The smell is great as always
5,2020-08-25,I love this yankee candle! It smells beautiful.
5,2021-06-08,Love the scent!I will be ordering a larger 1
5,2019-11-27,I used this every day and the tumbler size lasts for months
5,2019-07-06,"It’s worth the extra cost because it lasts longer than the cheaper candles, and smells much stronger."
5,2020-01-15,Came as described. Delivered quickly via Amazon Prime.
5,2018-08-28,"The actual fragrance of roses, it is soothing and light. Not over-powering at all.Would like to catch it on sale, so that I could stock up on them.MsJo"
5,2018-06-22,"Bought it as a gift, sisters favorite fragrance!  LOVES IT!! Just has it sitting in favorite room hasn’t lite it let just the smell from jar is great...😊❤️"
5,2020-02-10,Absolutely love yankee candles and this is one of the best scents!
5,2018-01-04,"I love the scent , it smells just like fresh cut 🌹.And Amazon isn’t as expensive as buying from a department store."
5,2018-06-30,"I bought this for my sisters wedding, she loved it which is all that matters, but i no longer buy your candles, too much money for no throw."
5,2020-05-21,My daughter loved the scent
5,2021-06-19,Smells nice
5,2020-09-24,Nice scent
5,2019-01-03,Lilac is my favorite scent and this candle is strong smelling but not overpowering. It was a great price as well.
5,2018-04-24,"Strongest and BEST smelling Yankee Candle! Was delivered in 2 days in perfect condition. I've bought more than one 'Large' YC from Amazon, and they always arrive as if they had come straight from the store. Would recommend this product to anyone who wants their home to smell like springtime and lilacs!"
5,2014-03-27,"My wife love's Yankee candles, and she loves lavender and vanilla.So... I got her this candle, and yeah it works...But seriously, it smells like lavender and vanilla, and burns evenly like all Yankee candles have for us in the past. Price was nice."
5,2021-08-18,Smells great. Perfect shade of pink. Love it!!!
5,2019-01-29,"Love the smell. Expensive as it is Yankee Candle, but, I could not find other good candles with jasmine scent"
5,2016-04-13,"I'm not typically a floral girl (I prefer fruity fragrances), but this was on sale so I thought I would try it. It has a nice throw and fills the house with the smell of summer!  I will buy again."
5,2022-04-27,"This candle smells so good, it isn’t over over pungent and freshens up my entire house!"
5,2021-01-08,Beautiful.  Smells great.
5,2020-03-22,Calming lavendar...even burning wick.
5,2021-06-05,Smells amazing. This is definitely my new favorite candle
5,2020-01-11,Love this scent! Smells like bubble gum...
5,2021-05-06,"I have loved this candle for over 20 years now! It is not an ""artificial"" scent that most other wax & candle products have.  There is no comparison on quality products, Yankee is always my go to."
5,2017-08-14,This is my favorite candle and it's a great price! I did have some issues with receiving melted or the wrong scent but they were great about having a new one sent out!
5,2020-10-28,Nice scent
5,2020-06-10,I love the scent.
5,2019-07-18,Love the white gardenia scent of this candle. It’s very light and fresh.
5,2021-04-07,"Love the scent! I bought a large jar, and it lasts forever, which is awesome."
5,2020-01-31,My favorite scent and a great price!
5,2016-11-27,"Smells just like lilacs! We have a relatively small living room (11'x18'), and the scent fills the whole room. However, I could see how it could be a bit strong for anyone who is sensitive to scents."
5,2020-02-25,Love the scent..  using it in the bathroom.  Color is as pictured.  Lovely
5,2020-01-26,Great product. Great scent. Longevity is ok.
5,2019-12-30,Favorite scent. Loud smell through out house.
5,2019-01-27,This is a physically big candle with a big pleasant scent. Well worth the money! We will be buying again.
5,2019-07-17,This candle has the best lilac scent of any candles I have ever bought.
5,2020-05-11,Awesome product.
5,2020-06-18,"I, mean, duh.. it's  Yankee rose 🌹"
5,2022-06-10,I loved it I'll order it again ... the scent filled your nose waking into my place !!!!!
5,2018-10-31,Love the scent. This was the real deal yankee candle. Smelled great. Burns well. Lasts a while. Sturdy. Pretty. Fast shipping and great price. Will reorder.
5,2019-09-02,One of my favorite scents EVER! It doesn’t smell overly waxy. Instead it smells like fresh flowers.
5,2022-01-28,The price was a little high ! Wish it was a little less expensive! But the smell is absolutely beautiful ! Love it
5,2020-01-05,This is one of my favorite scents from Yankee Candle and it definitely does not disappoint.
5,2017-05-16,"Love this candle! Bought one for me and one for my mom, who loved it too! Nice, fresh, strong scent that fills multiple rooms! I highly recommend this candle. Long burn time!"
5,2020-11-09,Very nice scent.
5,2019-12-27,Love the size and smell.. great price.. thank you
5,2019-05-22,Smells great burns clean.
5,2019-12-28,awesome price cheaper than the store and great smell
5,2020-08-23,Favorite scent! Love this candle
5,2020-01-14,Love this candle. Just wish it’d last longer.
5,2020-02-05,Loved the scent! It made my entire apartment smell terrific.
5,2021-12-30,I use this all the time. My favorite memory is we had a Rose scented Yankee Candle burning in the hospital room for my grandma when she passed away.
5,2021-12-08,I love this scent and being on sale was a major bonus!!!
5,2019-05-16,Love this candle sent! Smells so fresh for spring! Lasted the correct amount of time (40 hrs).
5,2022-04-30,My favorite flower. The candle smells amazing! A little smaller than I anticipated but still worth it.💯
5,2021-05-19,The scent is relaxing and the candle lasts a long time.
5,2019-12-02,Oh my gosh! This smells like fresh roses....perfect. Im in love!
5,2019-12-04,Gift for my mother who will only use yankee candles
5,2018-01-27,This candle I keep inside the kitchen. Gets all the food odor out. After I finished cooking you wouldn’t know that there was food cooking. It smells great too.
5,2019-12-11,How can one not love Yankee candles. Always smell great!
5,2020-01-05,Nice smelling candle and it is strong
5,2020-03-23,Smells great last long
5,2019-11-04,"I love this candle and this scent, good all year long!!"
5,2019-12-30,One of my favorite scents from Yankee candles
5,2020-01-11,Love this candle!! It has a nice soothing scent that spreads through my entire apartment.
5,2020-10-09,Wrapped expertly. Previous bad experience  with other sellers.
5,2019-02-27,The pink sands scent is my favorite. I love this candle and this is a great price for it!
5,2022-03-29,My girlfriend loved this small candle and the smell is amazing!
5,2021-07-27,This is my favorite scent ever. So light and summery great price for this size.
5,2020-04-23,This is my favorite scent.
5,2021-01-21,"Love it! Bought as a gift for my mother, and she absolutely loves it!"
5,2021-04-10,I always but it for a gift but end up using it for myself.it last for a long time and smells sooo good.
5,2020-02-06,Last a long time and smelled great!!
5,2020-01-02,Great smelling candle pretty good price to
5,2019-02-17,Purchased a few of these lilac candles as gifts. Smell great! Last long time. Good price.
5,2017-01-25,I ordered 2 - Macintosh and White Gardenia - so they both get the same review.  Who doesn't love Yankee Candles?  They were even delivered a day early!
5,2020-01-16,Not as powerful as other Yankee candles.
5,2021-07-19,Love ❤️ it!!
5,2015-07-29,awesome fragrance and extra benefit of saving dollars over store purchase.  I do not know if this price will continue (under $14) but this gave me the chance to try Yankee Candle in a jar for future needs.
5,2019-07-20,Yankee Candles are the best ones out there along with Salt City.  Price was awesome too.  Would buy more on here.
5,2021-08-23,"I have a large 1000 sq ft great room and I could smell the candle every where, hid the dog smell well."
5,2020-11-19,love the smell!!1
5,2014-07-01,"I've had these candles before in the ""glass mug"" but find the plain  jar less smoky and easier to deal with. The candle has a pleasant lilac smell, a bit strong (as lilacs often are) but not too artificial (as candles often are)./"
5,2018-02-16,I love the smell of this candle! I was going off the reviews and popularity of this candle when I ordered it. Thank you for such a lovely smelling candle!
5,2019-01-05,Love the scent and how long these Yankee candles last! I'll keep buying them for these very reasons!
5,2020-01-29,This is my favorite candle !!
5,2022-01-14,Loved the scent and it’s so real smelling
5,2019-12-12,Sent this to my daughter.  She loved it .
5,2012-03-29,"One of my favorite scents!!  Lilacs are so beautiful and fragrant and this candle captures their smell just perfectly!  It's worth the price...enjoy it!  As to how it was shipped, it was wrapped securely in bubble wrap along with the air pouches."
5,2020-04-02,Amazing smells that fills the entire home. Long lasting candle
5,2019-12-29,Great smell for a wonderful price.  I'm sorry I didn't order more
5,2021-03-18,fast delivery and arrived in perfect condition
5,2020-01-06,Was a gift for my mother who loves the smell
5,2022-06-16,I like the smell. But it was melted so No Wick. I can’t give as a gift
5,2022-05-02,A Gift for my mom
5,2020-12-23,love this candle
5,2020-01-17,Bought as gifts!  They loved them!
5,2020-03-22,Love it! It’s my favorite.
5,2018-11-27,This candle is great for anyone. It’s a nice subtle scent that can be used year round. I use it in my living room and it produces a noticeable scent but it isn’t overbearing.
5,2020-01-12,Great company. I love yankee candles.
5,2019-02-03,This is way cheaper here than at the store. This scent is my favorite. It smells very clean and fresh and isn't overwhelming. Love it!
5,2020-11-27,This my favorite candle scent.
5,2020-06-12,Gift
5,2020-04-11,This is my favorite. I love it!
5,2020-07-19,"Sent it as a gift, she loved it"
5,2020-07-01,"Scent is terrifico, and candle is burning now, everyday this great smell reaches all thru house, and will try others eventually ,if this one ever burns out?!"
5,2019-03-23,Smells like enchanted roses.
5,2021-01-02,Similar to a lilac scent
5,2020-02-23,Yankee Candles never fail
5,2019-06-15,This is my favorite scent! This candle lasts a longtime. I always get a lot of compliments on the scent in my home. This works great for me in my kitchen since it’s the center of my home.
5,2019-05-27,Good product great service
5,2019-07-01,Love this candle! Very strong sent made the whole house smell like roses!!
5,2019-05-29,My family usually has issues with candles but for some reason this scent doesn’t bother anyone. Love it!
5,2020-05-12,Great product
5,2019-08-23,"Yankee is the only candle worth buying, on my opinion."
5,2019-11-19,This candle smells amazing. My husband noticed the new candle as soon as he walked in from work! I will definitely purchase this scent again!
5,2021-02-20,Always m favorite scent! Quality that lasts.
5,2019-03-28,Long burning but still not the fragrance throw of wicksnmore.com jars and pillars!
5,2022-07-19,they offered a great deal for prime day and I couldnt resist! This is by far the best scent
5,2021-02-11,Delicious scent. Shipped and wrapped to perfection to avoid damage.
5,2020-03-14,Nice and quick shipping
5,2021-08-08,Smells just like a day at the beach!
5,2018-12-19,Not all the on sale candles smell like anything but this one is wonderful and pure.  Get it.
5,2019-11-09,"It takes a few hours to get the candle scent to spread the first time, but well worth the wait :)"
5,2022-06-17,I love Yankee Candle because I always get something I’ve never had
5,2021-04-28,Love this candle. The scent is one of my favorites. Soft and subtle.
5,2021-03-19,Pink sands is over of my favorite Yankee Candles!
5,2022-05-01,"The candle arrived in avery good condition , well packing, fast shipping, smells really good although its a light scent"
5,2019-09-24,"Loved this scent, and really great job with the packing"
5,2020-02-09,Great buy. Smells wonderful.
5,2022-05-31,One of my favorite scents hands down
5,2020-04-13,It is a perfectly happy fragrance.
5,2021-09-29,Love the smell
5,2018-04-02,"Favorite scent by Yankee candle. Now that I can buy them at a discount and have delivered,  I will be buying more. Thank you Amazon!"
5,2018-06-06,"Love this scent! Not overpowering... just soft, i purchased the large jar, small jar and two medium in the tumbler LOVE THEM!"
5,2019-05-21,Smells Great
5,2016-04-15,Take a walk through an outdoor rose garden. That is exactly what this candle smells like. My personal favorite. Great in a bedroom or where ever. Lasts a long time. I will buy again when needed.
5,2020-04-20,Smells good
5,2020-01-08,It was a gift....my daughter loved it
5,2020-01-02,What you would expect from Yankee.
5,2021-02-06,"The scent lingered thru my living room. The scent is smoothing, calm. Very relaxing."
5,2017-03-07,It smells SOO good. Definitely one of their best non forest / winter based scents. You literally CANNOT go wrong.
5,2019-07-02,Love this scent and yankee candles are great value for your money
5,2020-04-08,Pleasant smell!
5,2017-03-08,Love Yankee candles. I came across this one for only $16 which is the large jar. Nice scent & great price.
5,2021-03-01,This candle has a great scent and it lasts for a long time.
5,2020-02-20,Hands down my favorite smell. Sweet and clean smelling.
5,2018-09-03,Got this candle as a gift and loved it! The smell is so beautiful but not overpowering. I highly recommend it!
5,2020-01-04,Got on sale. Love yankee candles
5,2021-07-23,Smells like a real lilac travels down the hallway into Dining room and kitchen
5,2022-04-03,Love the scent
5,2019-12-20,"Great smell, great product!"
5,2016-08-09,"This candle is such a fresh scent and lasts all day, I burn it in the morning and you can still smell it into the evening I really like this its a nice clean scent cant go wrong just great"
5,2022-02-28,Smells as expected. I am pleased with this purchase
5,2020-05-29,Happy with candle and delivery  was great
5,2015-05-10,Wife and I believe this is one of Yankee Candle's best scents but difficult to find and we've been using their products for years. Mild and mellow reminiscent of a trip to the beach very relaxing scent.
5,2022-02-21,My go to favorite
5,2020-01-31,My favorite yankee candle.
5,2020-01-19,Nice aroma and looks pretty on the shelf
5,2020-02-01,Love the smell and quality of these candles. They last for a long time for our house :)
5,2021-10-10,Fragrance is strong enough to remove cooking odors.  My house smells clean and fresh before my guests arrive.
5,2021-01-04,Exactly what I ordered smells like the beach.
5,2017-05-16,Bought this as a mother's gift for my mother and she loved it! a great different option to flowers and the smell lasts much longer!
5,2017-07-14,One of my favorite Yankee fragrances; it does a good job of covering an average size room. Wick is able to be burned until jar is is almost completely empty.
5,2018-05-18,Wonderful candles  you lite them and they fill the room with lilacs.  I will be buying Yankee Candles again and again.
5,2020-01-02,I love these candles! This is my favorite scent!
5,2020-05-06,my favorite
5,2022-05-13,Lasts a long time!
5,2019-11-06,Love the way it makes my apartment smell so nice
5,2018-07-23,Bought it as a gift for my Stepmom. She loved the scent and the color was nice. Can't go wrong with a Yankee. :)
5,2022-02-17,I purchased this for an employee Christmas gift. Great scent and long lasting
5,2020-03-10,Bought for my daughter
5,2020-01-15,Smells really good.
5,2020-01-07,Smells wonderful burns a little fast
5,2020-07-22,I ordered it on July 18th and it was supposed to be delivered on July 24th but I got it on July 22nd (for a delivery in France it was very fast).It smells very good and I'm glad to have it while I can't find it in stores in France.
5,2018-09-01,I love it. It has a nice smell to it. I am going to keep the two I bought and I am definitely buying more.
5,2020-02-03,My favorite candle!
5,2020-03-12,I only buy yankee
5,2022-02-20,I loved everything about this scented candle AWESOME!!!!!
5,2021-04-25,It literally smells like a rose garden! It’s the best for me!
5,2020-01-19,Was given as a gift and it’s perfect
5,2022-01-03,Christmas gift
5,2020-03-31,Great scent
5,2018-04-03,Beautiful candle! It was packaged well. The scent is light but spreads throughout. Smells like fresh roses. Love this scent!
5,2020-03-05,One of my favorites...
5,2014-06-02,"This is the fragrance that many high end hotels use.  It is a clean fresh smell that does not over power the senses.  It is similar to the ""White Tea"" fragrance.  Hope they come out with more Summer Wish products."
5,2022-05-15,By far the best scent. Love Yankee Candles!
5,2018-03-12,Smells like a real gardenia without being overpowering. Would definitely repurchase.
5,2020-10-09,"Huge candle, and my favorite scent. Easy win."
5,2018-10-10,This has always been one of my favorite Yankee scents it fills the room smells so fresh and clean.
5,2020-02-02,Quality as always
5,2019-10-30,I love this scent. Great price
5,2020-03-23,Long lasting
5,2020-01-02,Would love it in different sizes
5,2022-05-23,Amazing for the price.
5,2020-08-15,LOVE the light sweet floral scent
5,2020-01-09,Love this scent!
5,2019-07-05,How can anybody not like Yankee candles? They’re the best! Have never been disappointed!
5,2020-03-21,I purchased this candle for a friend as a birthday gift.  She loved it!
5,2021-10-14,its dgood
5,2022-03-05,Great candle smells delicious almost want to eat it
5,2013-03-17,"5 stars it is everything I wished  for ,as a giftfor my tia, it smells terrific, will be buying twomore to save for other gifts pending, as youknow the quality of yankee candle havesuperb reputation. love it"
5,2019-11-26,Lasted long and smelled great!
5,2018-10-27,I am so glad I said it's up to come to me every month I can have the smells of gardenia
5,2020-01-08,Love this scent
5,2018-02-20,Product came in great packaging and smells great! Very happy with this great deal. Thanks for the great delivery Amazon!
5,2014-12-31,"It's amazing how this smells exactly like the lilacs that grew in Mom & Dad's backyard. The scent really brings me back to happy summers. It's flowery for sure, but not sickeningly sweet (like some of the other floral and fruit offerings by Yankee). I'd describe it as authentic yet even-toned; maybe even slightly understated. It's kinda like walking by the flowers in a greenhouse or farmer's market on a mildly warm summer day. I wouldn't change the formula at all - it's perfectly balanced. This has been a family staple item for years."
5,2020-10-09,Really the best quality thing! Thank you!
5,2019-12-06,Very high quality candles.
5,2020-06-07,I love this candle scent.  Smells like the beach!
5,2019-12-23,"Guys, it's Yankee... Duh it's good!"
5,2020-02-08,Love yankee candle
5,2018-02-05,Love this scent and how long it lasts. Yankee Candles are a bit more expensive but they last so much longer than the less expensive ones.
5,2020-01-20,Great smell
5,2020-02-20,best smell ever!
5,2020-01-10,What a great price! I was able to get 3.
5,2022-08-14,The smell was long lingering from the first light to the last
5,2019-10-23,My FAVORITE scent by Yankee candle!!!
5,2019-04-06,I'm a big fan of the floral smells. Jasmine is really gentle and relaxing.
5,2021-06-05,Welcome spring and summer!
5,2020-02-12,Smells det
5,2019-03-28,Yankee Candle quality with a big scent.  What more can be said?
5,2020-01-21,Great price.smells great.
5,2013-08-06,"This candle is very aromatic.  I moved into another apartment, and the previous resident must have kept a pet in one room, because it smelled like a zoo.  After burning this candle in that room for eight hours, all the zoo smells were gone."
5,2019-06-05,Perfect fragrance and so beautiful.  Ended up buying two.
5,2020-06-18,"Lavender/Vanilla is calming and does not have a strong, overpowering smell."
5,2018-12-12,"Great value for the money. Half the price of Hallmark, and laid on the front door step. Amozon is the BEST..."
5,2020-09-14,Used it as a gift to my mom. She loved it.
5,2019-04-26,"Love lilac scent, smells like I just cut blooms off the bush."
5,2019-11-06,MY FAVORITE YANKEE CANDLE!!
5,2019-03-22,Love color and scent but this color is a slow burn and hard to stay lite
5,2020-01-16,The smell is wonderful!
5,2019-12-09,Got as a gift for my girlfriend. She loves it a lot. Smells good and lasts long as well. Would definitely but again
5,2018-07-22,Nice candle. Smells good .Very good price for a Yankee candle.7.99$.Usually 15$ for this candle.
5,2019-08-14,"Been lighting this puppy everyday for at least 2 weeks, still have 25 percent left. And I burn for hours a day!"
5,2021-03-09,Love the scent! One of my new favorites! Glad I stepped out of my box and tried a new scent!
5,2022-03-06,Scent was on point. Definitely ordering the larger size next time.
5,2020-02-09,Smells beautiful
5,2021-01-20,"After Corona 19, people stay at home for a long time. So candles be the best gift! And it smells so smooth and sweet!"
5,2019-11-21,great candle works for days
5,2019-06-14,Absolutely LOVE this scent.. Last a long time.
5,2018-01-30,"Came well packaged. The fragrance reminds me of a warm spring day, light floral fragrance is nice and not overly perfumed."
5,2020-01-05,Love the scent!
5,2019-10-08,lovely fragrance but a little pricey
5,2020-02-09,Great smell
5,2019-07-24,Nice lavender scent at an even nicer price.
5,2020-02-11,Smells fantastic
5,2020-03-09,Good
5,2019-03-17,This is so amazing with an amazing scent. I am going to buy a lot of this in future
5,2013-01-22,"I purchased this fragrance based on the recommendations as I was having it shipped to Australia. (via a forwarding company), it didn't disappoint at all, it makes the room smell fresh and clean. Hides pet smells too. I do love Yankee Candles but will only buy them on sale from now on in."
5,2020-01-08,For my granddaughter she loves this scent..
5,2019-07-20,Perfect lilac smell.  Burns a long time.
5,2015-01-09,I love this candle! I ordered it as a stocking stuffer for my mom and it smells amazing! I am going to order another one for myself soon. I would recommend this to anyone who is looking for a gift for the candle lover in their family.
5,2020-06-28,Bought as a father's day gift he is happy
5,2020-03-13,Smells good. Lasts long. Good stuff.
5,2019-12-28,My favorite smell
