Rating,Date,Review
5,2019-12-13,"To the reviewer below: It's not Yankee Candles fault you ordered a scent u know u hate cuz your drunk & then have the audacity to give the product 1 lousy star, shameful.  With that said let me say I ordered 2 PINK SANDS scented lg . jar candles for office gifts and they were just as perfect a quality as tho bought in an actual Yankee store.  Stickers were straight, no bubbles, no hair as other reviewer tried to claim was case, filled level, wicks even.  If you are wondering about the scent,  I guess I can best describe it as a sweet mix of those strawberry hard candies, with a pinch of a cotton candy ish smell somehow combined with a light beach scent swirled with suntan lotion, sandalwood laden sand anotherwords ... ABSOLUTELY DELISCIOUS and not too summery that u cant can't burn mid January.  Infact, it helps me erase a little winter depression when I burn.One VERY IMPORTANT thing to remember with these candles for longevity is #1 TRIM WICKS down to 1/8 inch and monitor length. If you are seeing black soot on glass, wicks is TOO long. Also, all good candles recommend you light for 2 to 4 hrs at a time, let cool then trim & re - light. If you do this you will have perfect results.Ps. Never burn last inch or two as glass can crack ... *tip: Scrape out last 2 inches or so with butter knife (can put cool candle in freezer for 10 min. first for less mess) and put in a tart/wax warmer or save to use in one later. It smells amazing, gives u a few tarts worth and more bang for your buck, enjoy!!"
5,2020-05-05,"OH. MY. GOD!!!!! I highly recommend that you DO NOT BUY this candle! It is NOT the best damn candle scent you will ever smell in your life! It will NOT bowl you over with its room-filling, DELECTABLE fragrance! You will NOT find yourself inhaling deeply just to breathe more of its scrumptious, juicy, perfectly feminine, fruity-floral deliciousness!!! You won't be wishing that you had this fragrance in a perfume! You won't find yourself FLOATING around your home with your nose in the air, like a cartoon character hypnotically entranced by the wafting scent of sweet, tropical fruits resting on a bed of fresh flowers. And you CERTAINLY won't be RUNNING back here to order another one (or five) of these totally UNamazing candles because you WON'T want one in every room!I hope I've been totally clear. Because I absolutely DON'T have an agenda here, to ensure that there'll be more of these candles available for ME!!!:-D"
1,2018-09-28,"As the title states, I suggest that you do not order candles while you're intoxicated. I hate patchouli so I have no idea why I ordered this candle. I think I liked the name of it and at the time I was searching for a candle to put in my bedroom. I don't think I bothered to read the description of the candle or the reviews, which I normally do, and ordered it simply because of the name and because I like other Yankee Candles. Even though the patchouli is not the main scent, the fact that I noticed it at all was enough for me to dislike it. Also the candle had some hardened bubbles on the top and was not level, like it had melted and was slightly tilted on its side and then hardened in place. Neither of those reasons would have caused me to return this item - just a heads up to anyone who doesn't like either of those things. I am returning only because the smell of this candle does not match my personal scent preferences at all. Ew."
5,2019-01-14,"Full disclosure: I am a Yankee candle devotee. My usual scent of choice is Kitchen Spice, but I ventured out for this one to replace a very expensive Volcano candle someone gifted me for luxurious baths. I was not about to drop $40 on a replacement jar candle, nosirree, so this Yankee candle, on sale of course, fit the bill. The scent is refreshing and sweet, but not too overwhelming, and it reminds me of strolling on the beaches of Hawaii, i.e. heaven. I also love the cute, millennial-pink color, and as always, Yankee candles have many hours of burn in them. I am delighted with this purchase."
1,2018-12-13,"Y’all is NASTY. So I open up the candle and it smells amazing. Then I look and see that there’s a hair on top I though ok that’s gross maybe it’s my dogs hair and went ahead to light the candle and blow the hair away. After lighting the candle I realize to my horror that the hair is embedded in the wax, so I then decide whatever I’ll cut the price of hair out with a knife and the hair is really up in this candle. I ended up being able to pull the rest of the very long piece of hair out of my candle. Was it gross? Yeah. Did I still use the candle? Oh yeah it smells good. But yeah it was gross and who is making these candles??  How on earth do you get you’re long hair embedded in a brand new yankee candle?"
5,2018-02-19,"I bought this candle based off of the reviews from Yankee Candle. It was rated 5 stars. I’m glad I purchased this candle because not only is it beautiful, it gives off the most lovely scent. It’s a clean scent but it has warmth to it. This will def be our go-to spring scent in our home."
5,2018-03-09,"I absolutely love these candles. With the exception of being a little late I'm extremely happy! I was concerned about breakage after reading other reviews. However they came with plenty of packaging security for fragile items to prevent such thing! And as soon as I opened it you got a big wiff of lovely scent. And I've had it lit for a while and the scent has filled the room very nicely. I don't know why other customers had such a bad experience. They came perfect, smell wonderful and I love the pink, it makes the entire candle glow! I'm definitely gonna buy more!"
3,2018-10-06,Yankee mistve changed its formula than the yankee candles I used to buy. No other candle could compare to yankee. One yankee candle would make your entire house smell amazing. This candle doesn’t do that. Its reach doesn’t go past one room but the smell is nice.
2,2017-11-28,Ordered 2 and one arrived glass broken. Very Very little throw. Quality has either gone down on yankee candlesor these are fake. I ordered a few from the Yankee website on Cyber Monday so im going to compare. The scent isnice when you put your nose OVER it. This compared to lighting my Bath&Body candle and within 30 minutes you cansmell it almost throughout a 3000 sq ft home. Village candle and Scentsationals also give good throws.By the way I also tested this and a GLADE candle a quarter of the size in 2 guest bathrooms. After 2 hours  went tocheck and the glade smell was more stronger and evident.
5,2020-06-29,"So many candles have ""beach"" in their title/description, but smell like fruit! But not this one, it actually smells like being on the sandy beach next to the salty ocean. It's like a vacation without leaving the house!"
5,2020-04-14,"This brand has been around for so long. I remember it being THE candle to get years ago at the peak of its popularity, and honestly many products have come and gone and this one is holding up to its high reputation. It continues to be timeless.  The scent of Midnight Jasmine is perfect for those who just enjoy a light scent without being overwhelmed by strong smell. The candle itself lasts longer than any fancy candle I've ever bought. I love that you can remove the label so easily, since I normally like candles to just look simple/clean for decor reasons. Definitely worth it. If this review helped you in any way please make sure to click on helpful so I know. Feel free to ask any questions!"
5,2021-12-28,"I love my yankee candle. I have sinus problems so finding a candle I can smell is difficult. I lift the lids in the stores & if I can’t smell it I won’t buy it. Yankee candles have always had a great scent. I had a woman come over once when I had the lid off the jar as she came up my stairs she said “Thank Heaven , Scented candles” The previous place she went smelled like cats and dogs. I knew that person and she always has a very clean house. I had a cat myself but she couldn’t smell any cat smells. I keep a clean litter box because I cannot live with the smell. It gets cleaned after every use and taken outside to the trash . The other lady taught me that so I know her litter was clean. The candles make a huge difference."
5,2022-01-04,"From the description, I thought pink sands would be very sea breeze and beachy, but my first thought when smelling it was cotton candy perfume. My boyfriend says it smells like sweet bubblegum. BUT, please don't take that the wrong way because both of us think it smells delicious. I don't love overly sweet scents and this doesn't smell like straight up candy, rather a balanced fragrance of nostalgia, clean air, and--well--candy. I will buy again, but this candle will last a long time!"
5,2021-10-03,"As stated, the wife got me hooked on fragrant candles.  Lived half of my life without an opinion either way, don't know how I ever managed.Must admit, this Lilac Blossom scent is simply excellent.  A definite favorite of ours.Yankee Candle (JAR TYPE) are a favorite of ours.  Price is right too.We like aromatic candles that last.  Some are very expensive and yet, I have to put my beak practically into the flame in order to recognize a hint of an aroma.  Big League Taboo for this 52 yr old kids beak, as I blister easily not to mention the discolored tip which is generally black or in a shade thereof.Not to mention it simply does nothing for my looks.But not with these Large Jar Yankee Candles with so much aroma. My beak is safe at last.Thank you Yankee Candle.  My beak thanks you too.  ;)"
5,2019-12-12,"I rarely purchase floral sceanted candles.  Actually, gardenia is the only floral scent I buy & only from Yankee Candle.  I live in Rhode Island & like to burn this on a warm summer evening when the air is still & the windows are open.  You know the nights when there’s no breeze & nothing is really moving; but I don’t need the a/c on.  I light 2 of these on my first floor which is open concept.  They give off the most beautiful, warm, soft gardenia scent.  It’s not heavy or cloying.  It doesn’t choke you.  It’s not super sweet.  You’d think it would be when you smell the candle.  But when you actually light it, it’s just so smooth & pretty.  I’ve had an incredibly hard time finding this scent over the last few years.  I just happened across it on Amazon this summer for a great price & ordered a couple.  I thought they must be seconds or have something wrong w/ them; but, they were in perfect condition.  I couldn’t be happier.  😀 Amazon comes through again.  If you’ve never tried gardenia, I highly recommend giving it a shot."
4,2020-09-29,"I have bought and used several of these candles in different fragrances, including: Lilac blossoms, Midnight Jasmine, Midsummer’s Night, Pink Sands, and Silver Birch.I have four dogs and one enormous great room, which includes the kitchen, dining area, entry way, living area, and the dogs’ niche where their beds are. So I am always battling the smell to keep the house smelling nice.Overall, I would give this brand of candles 5 stars. Four out of the five fragrances I’ve tried were pleasant smelling, had a strong odor that would fill the large room, and a long life. They were packaged very well (inside their own box) and burn evenly.Here are my ratings for the scents:Lilac: Five stars. Very strong smell. Sweet and flowery. I love lilac but it was a bit much for my taste for the main part of the house.Jasmine: Five Stars (more if I could!). Wonderful scent. Flowery but not over powering. Mellow. Lots of compliments on this one and asking where I got it, etc. Can be hard to find, too. Recommended.Midsummer’s Night. Five Stars. Pleasant, “soapy” smell. Reminds me of what the bathroom smells like after a shower. I loved this scent, but it is nicer for a bathroom than a main room IMO. Recommended.Pink Sands. Two Stars. Very “pink” smelling. Reminded me of bubblegum. Scent was very weak. Could barely smell it at all. Wish I had returned it. Not recommended.Silver Birch. Five Stars. Very “woodsy.” Makes me think of fall/winter. Very pleasant smell for a main room. Recommended.I definitely recommend these candles overall, especially the four scenes above. The Pink Sands candle was such a dud I had to take off a star, but really these are good candles and worth the price."
5,2021-04-17,"This vwill FOREVER be my favorite YANKEE candle scent. It smells as if u are in your favorite place, even if you can't actually get there. I don't understand how people say it has no scent...or it has too much scent...or it smells too much like flowers.and my personal favorite so far.,""IT SMELLS LIKE SAND""....WTH REALLY?¿?¿? ANYWAY..... I will always be purchasing more than one at a time.  I do wish I could find the COTTON CANDY SCENT. I was only lucky enough to find ONE COTTON CANDY CANDLE..ONE TIME.  You should definitely try PINK SANDS!!!!"
5,2018-02-21,"I went out on a whim in getting this one. I had never smelled it, or even seen it in stores (I discovered upon looking into it that this is a new scent), and I thought why not? I am SO glad I went with my gut and just got it. The mix of the smells is just amazing. The apricot scent prevails over the rose for sure, which honestly surprised me! I feel like apricot is a hard smell to capture in a candle. The rose smell is also noticeable, but not over powering. It reminds me of the smell of Rosa  Double Delight roses (for those rose gurus out there) Which (for those of you who aren't gurus) is a sweet floral scent, with fruit like tones.This scent makes me feel super happy while its burning, and in my opinion is great for any time of day! I would use it in spring and summer, but not so much fall and winter if you live in a colder climate. Being currently in the desert that is Arizona, I would likely burn it any time of year."
5,2022-02-05,"The delivery was delayed a few days.  But that's to be expected from the 17"" of snow we've received in the last couple days. 👍. The packaging was exceptional. 👍. The candles were smooth at top with 2 wicks. (As expected with paraffin wax)  I've had this Yankee Candle scent before (PINK SANDS) and it makes your house smell AWESOME !!  👍. And the throw is GREAT !!  This scent is on everyone's top 20.  Definitely a top 10 for me.  I'm sure you'll love the fresh beach smell.  Buy it today you deserve the smile....😊😊😁😁  I give this Yankee Candle a FIVE (5) STAR REVIEW⭐⭐⭐⭐⭐"
5,2020-05-22,"AMAZING! I got this for my mom as a mothers day gift. She went on to tell me that when she went to the yankee candle factory last year in MA (we live in PA, yes candles are that big of a deal lol) where she dropped 500$. She told me about all the different candles she got, many which I am familiar with. I've smelled alot of nice candles in my life, but this candle is so nice. The scent is light but not in a way that you can't smell it. Light as in not in your face or very strong smelling. It really does smell like fresh cut roses. I told her this candle would last way longer than real roses and she loved it. I like it so much im ordering one for myself."
5,2016-01-22,"One of three floral scents (Rose and White Gardenia being two other favorites) I burn in my master bedroom, the combination is like being in a garden. In addition, because my bedroom is not enormous, the two each of the three scents, for a total of six large jar candles, gives off a genuine warmth, truly welcome on cold evenings. And of course the light from these candles, plus dim bedside lighting, gives a truly magical glow.I find the Yankee candles to be an unparalleled value for the length of burn time and the quality of the scent. There is no waxy smell, just pure romantic flowers. The floral scents, which I mostly favor, with the exception of the luscious black Midsummer Night's Dream, are true floral scents, almost as heady as the real blossoms themselves.When given the option, if you can afford it, always go for the large jars. By comparison, it is the best  value, giving a couple hundred plus hours of burn time. The only maintenance is trimming the wick after each burn and occasionally wiping off  the black soot from the top inch or so of the inside of the jar rim.Go for it ... the ambience is wonderful."
5,2022-03-30,"Though I no longer have night blooming jasmine outside my front door to welcome me home at night, this scent reminds me of many happy evenings. My old house had some right by the front door, & after coming home from a wonderful meal with my hubby, it was always so romantic & welcoming! Now, when I light this candle in the evenings it brings mew to my happy place (particularly great after ones of ""those"" days). If real night blooming jasmine always brings a smile to u...this candle will, too!!!"
5,2018-10-27,"Love Yankee candles so bought this one based on reviews. Needed some scented candles for a house being sold (recently renovated and strong paint smells, not very homely) for prior to public inspections. Tried a variety of scented candles but this one was the best by far! Such a delicious scent I don’t want to ‘waste’ it on open houses, I want it for myself! So I’m back to buy more. It’s a sweet scent, but also floral. It carried right through the top floor of the house (three bedrooms, 2 bathrooms and a hallway). It’s a delicate apricot scent with a stronger scent of a rich summer rose. I also bought a Gardenia Yankee Candle and that has a much more delicate and floral scent (still with that heady richness of gardenia, but subtler than this one). If you don’t like sweet scents this may not be ideal for you, but if you want a powerful candle with a great throw, this one will be a great choice. Came well packaged, arrived quickly and smells great straight out of the box. Burns well, although a little lack smoke from the flame. Worth it for the scent."
5,2021-12-28,"I have this candle on scheduled regular delivery.  The last batch had very minimal fragrance.  No, it has nothing to do with sense of smell being affected by covid.  I bought a different brand scented candle from the store in place of this purchase. It's scented and the aroma was just perfect.  I can smell it and it emitted a wonderful scent. I had several people try smelling the Yankee candle.  Each and everyone said there was hardly any aroma.  Please stop making excuses.  Someone.dropped the ball and covid was just an easy excuse."
5,2022-06-26,"Once again Yankee Candle, you're the best! My son bought this for me on Mother's Day, and since then, I've lit it every day and it makes the whole house smell great! I only have about 1/4 of the candle left, and it smells just as good now as it did when I first opened it. YC may be a little more pricey than other candles, but the quality is top notch. Couldn't buy a better candle. Now - let's talk about the JARS. It would be nice for YC to come up with different container shapes and sizes. The jar isn't the most attractive candle holder! I'd like to see them come up with ceramic or stone holders, in colors like grey and khaki and rose. Maybe they will!"
5,2020-07-20,"This has the reminiscent smell of previously bought Yankee candles. It filled the entire first floor of my home, 1200 ft.² with scent. And it smells heavenly. No skimp this time on Scent. It took 20 hours to burn half of it. So, it has lost some on longevity. Let's See how Long it takes to finish them up! Will return! They smelled great, but unfortunately some of the candles that I ordered had short wicks. Not even halfway through the candle the wick just disappeared. It happened in about 50% of the purchases. I believe I bought nine candles. Don't hold me to that but somewhere around that figure. But it was definitely at least half of the purchases were defective. The lilac smelled great, but some of the other sents that I bought were barely odoriferous! (Could barely smell them)"
5,2020-11-24,"When we lost my mom her personal touch was lost, My dad asked me if I knew what candles mom liked. Yankee was always a fave. I sent two of the lilac candles to Dad. He said the house was feeling right again. Thank you for helping my family heal and remember at the same time."
5,2016-01-22,"One of a trio of Yankee candle floral scents I like to burn in my master bedroom. The whole room smells like a garden, almost like the fresh flowers themselves. As an added bonus, the lighting is sublime and because our room is not enormous, the candles add actual warmth, very welcome on colder days, even in Georgia, which gets its fair share of cold days in Winter.The large jars burn a long time and I don't think I have found a brand that's worth what these Yankees are. The price you pay for them is worth it because they smell so wonderful and true to what they are labeled. I have not tried one nature scent yet that did not delight me."
5,2022-03-17,"Maybe that's intentional but it was unexpected.  I keep checking the fragrances listed in the description and don't see any rose scent listed there.  Not that it matters to me.  I'm loving the scent of this candle.  Yankee Candles are my favorite.  The large jars last a long time.  Some don't always burn all the way across - I guess that's called tunneling?  The scent on this one is strong, even when unlit.  The wick burns well.  I do have to keep trimming it to keep the flame from getting too tall.Think I'll go hunting for one with actual rose scent to compare."
5,2018-02-27,"Fantastic price, fantastic shipping, and a fantastic candle. I ordered 2 of these, and both were shipped in a secure, candle-shaped cardboard frame within the box so there were no issues with the glass breaking or cracking during transit. The Pink Sands candle itself has a unique smell that is hard to describe; there are hints of citrus and roses in the middle of a clean, crisp, semisweet airy cloud of awesome. I absolutely love it, and have yet to find another candle quite like it. If you're a fan of crisp scents (e.g., Clean Cotton) but also like soft sweet candles (e.g., Buttercream), you should definitely try this. Highly recommended!"
5,2020-01-11,"There is just no candle company anywhere that makes as good a candle as Yankee. Their scents are amazing, the containers are great sizes, and these candles burn FOREVER! They seem pricey, but truthfully, they aren’t—because they last so much longer than other candies. Watch for third party sales— you can get “used” candles—which are essentially just candles white boxes have been opened and then box and candle was returned for some reason—NOT burned. Those are available sometimes from Amazon and they are a few dollars cheaper. Great gifts, too. My family knows when in doubt, give Mom a Yankee candle."
5,2022-07-19,"I love this particular scent for easing my Anxiety at night, it helps me calm down and get ready to fall asleep.I would recommend putting it out before you go to bed, since it can wear the candles wax down significantly. (The scent will linger in your room even after the flame is out)My recommendation is to never blow the candle out, put the lid back on (so it’s sealed) and let the flame go out on its own.Whenever you blow the candle out it can give off that waxy birthday candle smell which overpowers the original scent and ruins the whole point of it.Other than that it’s a very pleasant candle to keep around just in case."
5,2021-08-03,"I absolutely LOVE the scent from this candle.We have so enjoyed all of the Yankee Candles we've purchased, but this scent truly reminds you of walking along a beach...and when you're in the desert of Coachella Valley, a walk on the beach in 120 degree heat is a very nice thought.This is the second one we've purchased, and love it soooooo much.  Perfect for summer when you're longing to get to the beach."
5,2022-07-19,"We were all over Italy for the month of May and during that time all the jasmine trees were in bloom and absolutely beautiful.  The smell was wonderful, so when I got home to an area that does not have jasmine trees, I ordered this Yankee Candle in the Midnight Jasmiine scent.  OMG !  Every time I light it up, the scent takes me back to a place and time that was so special !This Yankee Candle in this jasmine scent is recommended without reservation."
5,2019-05-28,"You can’t go wrong with Yankee Candles. I bought Bath and Body Works 3-wick candles during their winter sale online but nothing compares to the original makers of long-lasting scented candles. I found this particular scent is actually cheaper on Amazon vs. purchasing in stores. I ordered it at 10:30pm last night and it arrived at 10:30 am the next day. Saves me time, money, and gas! The 3 candles I bought on Bath and Body Works didn’t last long. I could no longer light the wicks even though there’s still a substantial amount of candle wax in the glass container. Plus the scent wears out fast. I do not experience those problems with a Yankee Candle.Tip: Burn the candle for at least 2 hours to get rid of odors. Extend the life of your candle by trimming the burnt part of the wick from time to time."
5,2021-11-21,"My daughter absolutely loves the smell of Yankee Candle Pink Sands! It has a strong throw that I find a little overwhelming in an area like a small bathroom, but it doesn't bother my daughter one bit. The scent incorporates citrus, fruity, floral, woodsy, and musk all in one. My daughter has loved this scent for over 2 years, and still isn't tired of it. I got her another one for Christmas. :)"
