Rating,Date,Review
3,2020-05-28,I was looking for something that smells like real lavender. This does not.
5,2016-05-11,This candle is a repeated purchase of mine. I buy  nothing else for my home but fresh cut roses by Yankee because the scent is powerful but not overpowering to the senses. It fills the entire great room with a fresh inviting smell that is soothing.
5,2020-02-14,"Favorite scent, this is what I love about amazon. When you cant find it in the shop you'll find it here."
2,2019-02-06,Not as fragrant as other less expensive candles I have purchased. It was not calming and relaxing like lavender should be.  Too expensive and not worth it!
5,2018-05-17,Love the Lavender scent. So disappointed they have discontinued the pure Lavender and the pure Lemon scents. There are mixed scents available now but they are not the same!
2,2020-06-13,"The Beach Walk Yankee candle has a heavenly , cool, clean scent of a summer at the lake.  I live one street behind Lake Michigan, and whenever I am outside on a breezy day , and can smell the beach.  It  is a relaxing and comfortable feeling.  That's how I would describe the interior of my home when the I go out, come  in , and inhale the scent of this candle.  I would rate it a solid five stars, except that my particular candle has a split wick, and every time I light it, it flickers and smokes continuously.  No matter how many times I cut the wick back, it  ultimately splits again and again, and smokes again and again.  I cannot  enjoy it for more than 10 minutes or so, before I have to snuff it out.  Mine was a glitch.  I will buy it again all summer long because this was a one time defect, and it wonderful.  Cheryl"
4,2010-08-11,"This candle releases a good Honeysuckle odor that is not overpowering and is perfect for any room size. The best part is that the burning time last for awhile! The burning time is much longer than cheap traditional candles. Although you might pay a little more for this one, you get what you pay for in the end."
5,2019-07-25,I love their true Gardenia scent and always take one of their candles with us while traveling for a wonderful scented room.
3,2020-11-21,Size as expected. Scent was less on the lavender and heavier on the candle scent.
4,2008-05-02,"I am very happy with the product and the short time it took to receive it.The jar, unforunately, broke during shipping but not a fault of the seller. The item was well packaged so I suspect poor handling by USPostal Service.  In any case, seller sent compimentary matching small jar candles in same fragrance as good will gesture.  I would buy from this seller again."
5,2021-01-21,burns perfectly.
3,2020-07-01,The candle smells wonderful. I gave it 3 stars because it arrived broken but I'm still keeping it. they really need to pack it much better
2,2021-03-21,"This is my first time ordering a Yankee Candle. Read all the hype on this brand. Watched a couple of YouTubes; was impressed. I was juusst about to buy another brand which was going to cost me $15 for only 6 ounces (should have stuck with that choice). However, I found some Yankee Candles at a good price. Received my ""Pink Sands"" candle fast! (happy/excited) But what a BIG disappointment! Absolutely ""No scent"" from my candle? And No, I don't have Covid (lol) Usually you can smell at least a slight scent during the unboxing stage. Even when removing the lid, still no scent? That should have been a hint. However, I thought ""maybe"" I needed to burn it to smell it. Still nothing? Placed it in a small bathroom with the door closed for about 15 min, still no scent? Tested on two other people ~ same result. Is it possible I got a ""DUD""? Maybe it is old?  I don't need an expensive emergency ""power outage"" candle. What a waste of money! Unsatisfied Customer here for sure! Even though it said it was new on the listing, It ""seems"" like it was maybe a return? And I'm sure if it was, it was due to the same problem. Unfortunately, you can only return the candle in new or unused condition. All the favorite Yankee Candle scents that YouTubers put in their top/favorite lists like, ""Pomegranate Cider"" or ""Pumpkin Wreath"" are recently listed for double compared to what I paid. My candle ""Pink Sands"" was one of the lowest priced Yankee Candles I came across. Now I know why....I gave a rating of at least two stars. 1 for fast shipping and 1 for no broken glass."
5,2019-04-30,"I like the color, and the scent before lighting, once lit however, it has to burn for an extended period of time before the aroma fills the room."
1,2021-08-28,"This candle is very small.  It is just slightly larger than a votive.  Not what I expected so I regret the purchase.  Also, the scent in undetectable when the candle is lit."
2,2020-10-17,"Can barely smell this, even after burning for hours. (Lavender scent)"
5,2022-05-02,-
4,2022-06-18,"Bought the lilac smell, smells good but the smell doesn't last or goes very far in the room. used to be Yankee candles were really good but something has changed with them because the smell doesn't go very far and the smell doesn't last."
5,2021-12-13,The candle is the same as sold in stores except for a better price. I am very satisfied.
4,2016-06-04,Smells amazing! Really smells like fresh cut roses and not like some horrible toilets spray.However this is a 7oz candle jar advertised with a 12.5oz picture. Very misleading!
1,2019-01-06,I can’t use this because it came shattered. Before I even opened the box I could hear the glass rattling around. Amazon not being helpful with replacing the item. Surprise 🙄
3,2020-08-14,This did not smell like lavender.
1,2020-10-24,The entire Yankee Lavender Large Candle was melted to one side and inside the top.....melted was residue was on the outside of the box also.
5,2020-01-17,Beautiful apricot and Rose scent. The throw is low though unless you burn in a smaller room.
5,2019-07-27,Love this smell  although don’t buy the car fragrance because you can’t return it and it smells like crap
5,2018-02-18,"This is one of Yankee candles most beautiful candles. Have not been able to find a candle that captures the honeysuckle scent as well as Yankee candle does, and they discontinued it! Why??"
3,2019-06-30,This does not take the place of Relaxing Lavender.  It does not have the same scent or as strong.  This is a bummer.
3,2021-02-25,I ordered a bunch of candles for my new apartment. The worst by far were all the Yankee Candles. They all smell terrible.
5,2020-03-11,"It filled the bill, so to speak and made a delightful Christmas gift."
4,2021-06-30,I should have made note of the size.  It is smaller than I expected.  It smells fantastic.
5,2021-03-28,like it
5,2019-04-30,This is by far my favorite rose scented candle! It is a soft floral scent that you can smell even in a larger room. The candle also lasts for a long time. Definitely recommend!
5,2021-02-16,Love it
4,2021-05-08,"The smell is fine and a little bit weak, but not weak enough to complain."
5,2018-02-17,"Although it doesn't smell like pure roses, it does smell very pleasant and works really well. The scent covers 2 rooms and a hall. Will purchase again at that price. Very satisfied."
5,2017-10-19,Yankee candles are the best!
3,2019-03-20,Love the smell of Lavender/Vanilla but this candle does not have a very strong smell.  Can hardly tell at all in a small room.
5,2014-03-19,"I purchased this candle for my mother for Mothers Day 2013, it is now March 2014 and the candle still has burning time in it. She is always lighting this thing, it has a beautiful scent, it spread throughout the house like no other candle before it. Highly recommend this candle."
5,2011-07-02,"This candle is the best capture of geniune lilac fragrance that I have found. I LOVE it. One male co-worker thought it smelled like roses, but I think he just did not know his flower fragrances. Wonderful spring smell that fills a room; totally delightful."
2,2022-06-30,A friend has this candle in her office and it can be smelled throughout the building. I love candles and a loyal Circle E candle fan. I decided to step outside the box and try this candle in my home.The glass jar is beautiful but the scent is not strong at all.You win some. You lose some.Won't buy again though but will keep the pretty glass jar.
5,2019-05-25,Great gift for Mother's Day. Smells exactly like it says.
5,2018-11-21,Dual wicks ensured the large candle burned equally and fully.  Jasmine fragrance kept the room scented without overwhelming the senses.
2,2019-03-08,"I love yankee candles but this scent was weak to barely  any sent,"
3,2021-04-19,"Too much of a rose scent for me, still a nice candle though"
3,2014-01-07,"Love the aroma, but this size jar does not burn well. There is 1/4 of the wax left when the wick is burned out, and it burns in a well-must push soft wax down jar to even get that much. Very wasteful and too expensive. I am very disappointed and will not order this size ever again."
5,2021-02-28,Good fragrance lasts a long time.
5,2021-02-13,Best floral scent that YK makes.
5,2020-12-14,I purchased more for gifts
4,2019-08-25,Love the relaxing lilac scent after a long work night...Yankee Candle always is the best
3,2019-03-29,"Smells great but didn't burn very evenly, completely or slowly. Nice scent but not enough value for the money."
5,2017-04-25,"Very aromatic candle, truly rose fragrance."
4,2021-06-13,"I hope this is a legit one, as it came with no label. I got it, because I have a beach theme in my house, and thought the label would even look cute, when I was burning it. But now no label. It smells ok, but the candle doesn't totally look right either. The other one I ordered, looks fine and with a label."
4,2022-01-16,"Very good lovely scent but when there was maybe 3/4 of an inch left of the candle, I lit it and it sent off the hallway fire alarms of my apartment complex but not my own apartment fire alarm. I guess strong smell of plastic indicated it should've been thrown out slightly before then."
1,2018-07-22,"This candle has pretty much zero scent when lit. It’s fragrant when not lit which really doesn’t make any sense. I’ve had yankee candles in the past and they’ll fill a room with the scent, it even will travel upstairs... this one was a waste of money. Only reason I won’t/can’t return it is because I’m currently living overseas and the cost to send it back would be about the same cost of the dang scentless candle."
5,2020-02-08,The fragrance is soft and smell wonderful when you burn it.
5,2018-08-05,Smells just like freshly cut peonies.Fragrance lasts for the life of the candle
5,2013-06-07,"If you're like me you have favorite candle scents and sometimes they are best being simple in their fragrance. I like to have to Lavander on me or around me when I go to sleep;  via lotion, aromatherapy oil on my wrists and a candle.Great because it's not to be mixed with a Vanilla scent!"
5,2019-04-18,One of the most lovely and relaxing candles ever. Smells legit like a rose garden. You feel fancy af.
2,2020-07-31,"I'm very confused, I normally buy Yankee Candles at TJ Maxx or HomeGoods and they have a much stronger scent! In fact I have this exact candle in a larger size that smells way better! It's like this candle wax is old and it gives off absolutely no scent whatsoever! I should have known better and saved my money. First time I ever ordered a candle like this online that I have bought in a store, I will never do it again. You think it has a great smell until you burn it and you realize it doesn't have a smell hardly at all! Like it's old or something. Unfortunately, you can't return it once you've lit the thing so I guess I won't be buying Yankee Candles online again"
2,2020-02-16,"The media could not be loaded.
                
            
                
            
        
    
    
 I love the smell but my candle arrived broken I’m so disappointed. I was really excited for it but it just left me paranoid in ordering it again 😔"
5,2012-09-11,Be detailed and specific. What would you have wanted to know before you purchased the product?Not too short and not too long. Aim for between 75 and 300 words.
5,2020-03-11,Love it! Delivered in perfect condition!
5,2017-07-21,This is my favorite Yankee candle scent by far! It feels my whole house fairly quickly with the sweet smell of true honeysuckle! Just wish it was easier to find! Highly recommend!
5,2020-08-09,This is my favorite bedroom candle.
1,2020-05-30,Have always been happy with Yankee Candles but this has minimal scent.  Will never buy Yankee products again.
1,2017-03-03,I have it sitting not 4 feet from my head and i still can not smell anything. You have to put your nose right up to it. It's a shame i was looking forward to it.
5,2018-12-30,"My boyfriend loved it, he asked me if I had to order it because we could not find lavender scented candles in the store."
5,2010-10-30,"Yankee candles make the best gift! I purchased this item for a friend recently and she loves it.  I am a fan of Yankee candles and I will never go back to any other brand of candles. They smell great and last for a long time. They are a bit pricey, but you get what you pay for...great quality!"
5,2019-02-26,"This candle smells amazing and it burns evenly, just remember to trim the wicks before lighting it each time"
1,2020-06-09,"it arrived broken, damage"
5,2018-12-25,"This was purchased as a gift.  It smells great.  If it burns like my balsam and cedar candle, it does great."
1,2019-08-26,"This is a ""barely"" scented candle.  Yankee is NOT the company it used to be.  I will not buy another Yankee candle."
5,2015-05-09,"I LOVE rose scent, this is great and it smells wonderful. Currently burning it right now! (if possible, use a ceramic topper, it burns all the way down, nothing left on the sides. Wonderful buy!!"
5,2018-10-29,Smells Amazing. Great pricing packaging awesome quickly shipping
5,2020-03-05,Pleasant scent that is not irritating at all. (I am sensitive to a lot of scents)
5,2017-02-24,"LOVE MY LAVENDER AND EVEN THOUGH I COULD PROBABLY FIND A CHEAPER CANDLE, YANKEE CANDLE IS A TOP NOTCH CANDLE COMPANY AND THE FRAGRANCE IS GREAT! THANKS!"
3,2021-04-27,i generally buy white barn three wick candles but i saw this was on sale and decides to try pink sands bc i was curious. this candle was cheap bc the smell is so faint that unless you’re literally standing over it you smell nothing. it also burns very quickly. Save your money and buy the higher quality white barn candles. These was a complete waste of money and time.
5,2018-03-17,"Clean, light scent.  Not overpowering.  If you are looking for a scent that says clean and fresh when you enter your house, look no further. Love it."
5,2019-12-30,Absolutely LOVE this scent. Will be purchasing again!
5,2013-05-20,"I agree with previous reviewers - smells like real thing. One of my favorite along with Pineapple-Cilantro. I use them only with candle warmers - Candle Warmers Etc. 
  
Candle Warmers Etc. Signature Aurora Candle Warmer Lamp, Bronze"
5,2018-10-11,Love Yankee candles always. I always have them in home.
5,2020-04-23,Product came professionally packaged and is exactly what I ordered!  Love it!
5,2019-07-22,Really nothing to say it is a yankee candle one of the best.
5,2016-10-17,"Bought this for one of my altars since the incense was bothering my spouse. It's absolutely perfect, and has a great strong but not overpowering aroma of roses."
1,2021-03-27,I tried to order a lavender scented candle. First candle was the right size but the wrong scent. I ordered a replacement. Second candle was the wrong scent and the wrong size. Ridiculous.
5,2021-11-25,What's there not to like about your candles. These candles fits any mood you might have and will last forever
5,2020-11-19,Excellent
5,2020-05-31,Would buy again
5,2020-05-12,Highly fragrant and smells just like roses!
5,2018-09-19,Well worth the price.  Comes packaged very very well
4,2018-07-19,It is a bit too mild. I with the wick was thicker so it would last longer and the wax wouldn't be wasted stuck to the sides of the glass
4,2017-03-19,if i was able to afford it i would burn these non stop everywhere i went. i really love the scent and the two wick version of this candle.
5,2019-12-01,Great product just as described
4,2020-10-23,"Enchanted Moon is a nice scent.  It is an older candle and they lose some scent.  Still, it does smell good and provides a perfect light for Halloween.  When you buy for half the price. You’re getting an older product.  If you want the freshest best throw, buy direct for full price.  Wax packaged well and candle was perfect."
3,2017-02-26,Has distinct rose scent but I would not agree with the reviewers saying that it is a light scent or not very strong. The scent is very evident and strong. Gave my roommate a headache after only a short period of burning the candle.
5,2018-06-22,Love this candle filled the whole house with the smell of lilac made me feel like I was back in New England( live in Phoenix now)
5,2018-11-12,Love the scent! I light it before bed every night. Lasts so long! Will buy again once it burns out.
5,2019-03-18,It arrived quickly and in perfect condition. It smells amazing and burns for a long time. My only complaint is that there were air bubbles pressed agaist the glass that made the appearance of the candle a little less pristine.
4,2021-02-28,"Well, we all know how expensive these guys can be, but some scents are worth it to me.  I wait with bated breath for Hearts and Roses to return, but am not optimistic about it.  This one, Enchanted Moon, will disappear, too, I am sure.  So I was glad to see this available at least a little while longer.  Sigh."
3,2018-06-19,I love the Sun and Sand scent from Yankee Candle but it seems that the scent doesn't last as long as it used to.
2,2020-05-06,Actually SUPER disappointed with these candles. Yankee candles have always been my favorite. I’ve always been able to count on them to keep my home smelling fresh and clean. The lavender vanilla is one of my favorite scents because it’s such a relaxing scent. I bought two because I burn through them so quickly and I NEITHER of these candles give off a scent at all... $40 wasted. : ( Not sure I’ll ever buy a yankee candle from here again. At least I know I what I can expect from the store or website itself.
5,2012-10-24,"I LIVE Yankee candles. When this scent came out, I was so excited because the smell was nice. Little did I know that this 22 ounce jar would be able to emit scents throughout an entire room, even while it wasn't lit. I can smell this candle no matter what, and it is hands down my favorite scent!"
1,2019-04-16,The scent is TOO STRONG. I recommend purchasing Midsummer Nights Dream.
1,2020-09-14,This is not a real yankee candle. The sticker has been placed on the candle and put in a Yankee Candle box. Has no scent before burning nor after lighting the candle.
5,2014-06-24,"My room has high ceilings and is large.  It is difficult to get a candle with  enough throw to enjoy it.  The 2 wick tumblers are the answer for me.This fragrance is relaxing, flowery and not overwhelming at all."
1,2020-12-24,when I recieved the candle it was all melted in the could not even burn it and I had opened it and threw the box away so did not even noticed that it was all melted...$17.00 dollars down the drain. Very unhappy with this purchase.
5,2014-03-04,"I love to burn lavendar candles.  They have the freshest, cleanest smell.i have a very difficult time finding pure lavendar .  Yankee seems to think it needs to be combined with vanilla or lemon or some other scent.  I think all that does is ruin the true essence of lavendar! Vanilla was the first scent that ever came out in candles, and i burned so many vanilla candles, that i cannot stand the smell of vanilla today!"
5,2018-02-28,Of course it’s 5 stars its Yankee Candle! Anddddd packaging was 100% on point! Fast shipping! Great job alllll around !
4,2018-09-16,One complain on how they shipped my 4 candles. Two came sperate small yankee candle boxes inside the the shipment box and two did not. By doing this when I opened my box one of the candles was completely shattered so to how they shipped them. Other then this problem I love yankee candles and you can get them for half the price on amazon. My favorite scent is the pink sands. Last long and makes our home smell great!!
4,2019-08-18,"Smells good, but size does not reflect the price."
4,2020-05-21,Smells great
5,2019-08-19,My favorite yankee scent!! It's soft and feminine. I love to burn this candle in my bedroom.
4,2020-01-20,It was completely broken when I opened it....
5,2019-03-05,"Smells good but not a strong scent.Burns nicely ,evenly all the way down."
5,2011-10-10,"This candle smells nice, and it burns down evenly.  Not doing that is the biggest problem we've found with large candles - and then they don't last nearly as long.  This also looks very nice with the cap for when you're not using it."
5,2018-09-21,Love love love the smell of this amazing candle. Will definitely buy another when done 😁
4,2020-12-13,"Love how long the candle lasts although, the scent wasn't as strong at first. But, over time it started to fill my room and it seemed to work fine to me."
5,2013-01-04,I just love the smell of lilacs in the summertime. But now I can also enjoy it in the winter time. This candle smells just like a Lilac bush inside the house. I really like it. It is what it says it is and more.
5,2014-02-14,"When I first found this scent, I was thrilled... then I couldn't find it anymore!?!  Yankee Candle said (at the time), that it was a seasonal fragrance. I can only assume, that due to it's popularity, they revised that concept and now offer it year round"
4,2019-01-04,"I love the smell of this lilac scented candle.Its a oerfect smell of lilac than ever I smelled in my whole like.Great price for the size and burns almost to when it needs to.Almost to the bottom,which some are not great in the past I tried and didnt burn out all the wax completely.It more smells fragrant in the jar than it brings out a smell in a room.Still its the best floral smell I smelled and its just worth so much.That it smells lije lilacs.The real thing."
5,2019-05-22,Lavender is the best!
5,2015-10-08,The jar is quite large and has a very good burn time.The scent is strong enough to fill my living room but not overpowering.I've found Yankee Candles have spoiled me and I expect every candle I purchase to fully fill my rooms with the scent as well as this jar does.
5,2019-12-21,Perfect gift
1,2020-06-24,My candle arrived completely shattered!
2,2020-12-24,No label on candle didnt look like picture on site
5,2019-12-27,Good cost
4,2020-09-08,To small for the price of it
5,2014-04-24,I bought this to burn on the anniversary of my mothers passing as roses were her favorite.It scented the whole house and even after 24 hours of burning I can use it again next year for another 24.
5,2016-05-12,"Best quality candles, excellent fragrance, a bit expensive but long lasting and smell beautiful. Keep glass top on when not in use."
5,2021-08-02,Really wish Yankee would bring this Lavender scent back!!
1,2020-05-13,Very disappointed. Paid good money for this product. Lacks fragrance and seemed to have additional wax poured in top and hardened.
5,2018-01-29,This candle smells absolutely wonderful. It's perfect to freshen up my bedroom!
5,2018-09-25,"Bought this for the color, hard to find a deeper pink. And to top it off, it smell good, too!"
5,2020-01-03,No comments
5,2020-09-22,"its super scented, so it's great! It lasts a really long time!"
4,2022-06-01,"We were curious to know what Pink Sand smelled like. Sea weed, dead fish lowtide? Turns out it's kind of an indistinct floral, earthy scent. Not great."
1,2020-10-04,"This scent was waaayyyy too strong. At the risk of sounding rude, this reminded me of an expired perfume. The peony is the only note I could smell. Not halloween or spooky smelling.Defintely returning"
5,2017-06-10,👍🏻
5,2020-04-04,Very Good
5,2018-09-11,Love my lavender scented candle!
5,2019-04-30,"I love lavender candles, and it’s very relaxing. It gives an living space an amazing calming and pleasant smell."
5,2015-02-10,This is one of my favorite candles...since I no longer live close to the beach and going there is not an option all I have to do is light this candle and close my eyes and I am there! Amazing how they captured a day at the beach in a candle!!
1,2019-07-26,"Waste of money, has no smell."
5,2018-08-03,"Holy s#%t Batman, these are the bomb!! My husband and I are vegan and these are a perfect treat!!"
5,2019-07-02,"Good price, delivered fast. Candle has a nice scent."
5,2019-03-29,I found this scent by accident and it is so amazing. It is like the blue ocean. So I bought several of them!
5,2017-03-18,I cant get this anywhere . I love the smell and Yankee doesnt sell it anymore.
4,2022-02-11,Smaller than I expected. The smell was strong when opened but doesn’t smell as strong when lit. Candle also doesn’t stay lit. Love the smell though
5,2018-10-21,Beautiful scent!!
5,2018-07-11,The best gift I ever gave..... They couldn't find any in the Yankee Candle stores...Yah!!
3,2015-11-11,"It smells good, but I can tell the candle is a little old. I know this is a discontinued scent so I knew it wouldn't be brand new. I think they should have discounted the price."
5,2019-08-30,"The best! If you find it in car fresheners, grab one!"
5,2019-03-11,"I love yankee candles. The package came promptly, and is authentic."
5,2017-02-14,This candle fills the room with a wonderful Jasmine scent. All to many scented candles have no scent unless you are standing right next to it.
5,2019-06-04,Wonderful candles love the smell
5,2019-06-20,Great gift lasts long when used.
1,2021-02-15,No lavender scent whatsoever. Does not burn clean.
