Rating,Date,Review
1,2022-01-12,There's barely any scent and my gift was late because the first one came completely shattered!!!
1,2022-01-12,"Ordered this for a friend for Xmas, glass was broken,  no damage to box.  Ok, returned it for exchange,  it came in broken also, no damage to box. Returned it and gave up, both times I went to UPS to return my truck smelled great from the candle."
1,2021-09-02,"I was beyond disappointed when I opened my candle and the wax was above the top of the candle. I was looking forward to this, but now I may not order it online ever again for fear this will happen again"
4,2019-10-04,Loved the smell of the candle but unfortunately it was broke when it arrived 💔🙄😴
2,2020-07-26,We have been buying Yankee Candles for over 15 years and these candles burns way too quick. They do not last as long as the Yankee Candles bought from the Yankee Candle store
2,2020-07-17,"This was such a wonderful smell, but I couldn't even fully open the box because the entire candle jar was shattered in delivery. There was not even any bubble wrap inside the box. So disappointed."
2,2019-08-07,Not happy... Scent wasn't strong at all.
3,2018-02-17,Not one of favorites. Very faint smell.
3,2018-04-26,Smell is ok. Won’t knock your socks off.
3,2022-02-03,Smells like bubble gum..
3,2020-05-22,This candle lasted a long time but didn’t have much of a scent when burning.
5,2017-10-28,Great
1,2021-10-17,Received candle glass cracked in several places. Unable to use. Very disappointed with delivery
1,2020-09-16,If l could have given this 0 stars that rating would have been warranted. This item was delivered twice each time the glass jar was broken. Scary when you hear glass rattling in the box.  The good thing was I'll be refunded but only after the defective product received back to Amazon. I did not get my full refund. Taxes paid for not equal taxes refunded.
3,2019-12-15,The candle was a great value but the scent was very subtle.
1,2021-05-25,"Yuck. The top notes were very artificial lilac; sweeter than the real thing, the base notes were of singed chemicals. Nope. Trashed it."
3,2020-11-14,I really Love this product the scent OF this candle really smell good
2,2016-03-08,"I got a different scent pink sands if my last review posted sorry I was just upset at the moment, really wanted the rose scent ill give the one I got away to someone"
1,2021-03-15,I always burned Yankee Candles and have been pleased with them.  I put this in a small bathroom with the door closed and could barely smell it.  A HUGE waste of money.  The fragrance was pleasant but barely there.  Will never buy this again and it makes me wonder...has Yankee Candle changed the quality of their candles?
4,2016-03-24,love it
1,2020-12-19,This scent isn't as bad as Fresh Cut Roses but perhaps the paraffin is the reason for my headaches.  It doesn't take long for the smell to become uncomfortable.  Perhaps my allergies are a factor but I do have other candles that don't seem to have the same effect.
1,2020-06-27,"See comment on the other candle I bought. Don’t care for them.Overpriced,poor quality wicks wasn’t in the center of candle.I have been buying and burning candles for many years.Yankee doesn’t have the same good quality it use too 😟"
1,2021-05-30,Returning this candle because it fills the room with smoke. I have trimmed the wicks multiple times. Tired is messing with it ;( Going with a different brand.
1,2020-12-13,"I always thought Yankee Candle was the best money could buy, but I noticed a large amount of black smoke from my Yankee Candle, so I did some research. Turns out that Yankee uses paraffin wax, which is derived from a petroleum by-product, and so while these candles smell nice (before you extinguish them), burning these are like running little diesel engines inside your home. No thank you. Soy wax or beeswax from now on."
3,2016-11-29,"The smell is great, but definitely not worth the price. I bought other candles of half price and same quality."
1,2022-03-08,Don’t buy the lilac one it literally smells like cat piss.
3,2018-06-11,Yankee candles dont smell as pungent as they used to.
2,2014-08-25,"Candle arrived late (due to rain) and was 1/4 melted with no visible wick to burn it.  I will use it on a ""warmer"" as the sentis exactly what I wanted and not willing to pay to return it."
2,2013-11-27,"This was my first time purchasing a yankee candle. I ordered this one because of the high reviews so my expecations were high, and sadly I was very disappointed. I can hardly smell the candle. Will not purchase a gain."
1,2020-08-03,"Right when i picked up the box I knew something was wrong. I heard noises inside which was unusual since this is a candle...there should not be clinking noises. The candle was inside the candle holder, in the yankee candle box, in an amazon box with two  “airplus” bags. Not sure how it could have broken like this but it did. Pretty disappointed as it was supposed to be a gift for someone. Wish they could have done better. Be aware this is a possibility when ordering this through amazon. Something to think twice about."
3,2018-07-31,The smell is very nice and light. It came melted and I had to dig the wick out destroying the top of the candle.
1,2019-02-20,"What a rip-off and BIG DISAPPOINTMENT! I burned this candle for 2 days! Once on my dresser but couldn't smell anything! I then moved it to my enclosed bathroom for several hours but still couldn't smell anything! I'd expect this from a lesser brand cheaper candle, but not Yankee! I was all excited because this was supposed to be a new scent! What a let down! 😤👎🏽"
5,2017-06-15,great gift
4,2019-12-13,Yankee candles are a bit expensive.
1,2021-05-04,This candle smelled of nothing except heated wax. Extremely disappointing.
1,2019-07-24,"This candle has no scent. It smells like lit up wax. I’ve never been so disappointment in a purchase in my life, it’s definitely because of the cost and because it’s a Yankee candle, I would return it but have thrown away all the packaging.Don't purchase this scent."
1,2019-12-04,"I smelled this candle (enchanted moon) at Walmart and kept it on my wishlist until Black Friday when it was on sale. The candle I received barely even smelled, and did not smell ANYTHING like the exact same candle at Walmart. The one I received is perfume-y and gross."
4,2019-07-08,Great smell! Unfortunately my candle came broken so I'm pretty bummed about that!
3,2020-01-08,"I think, by the scent, it is old"
1,2021-01-02,This did not ship well... must have melted during shipping. All the wax shifted to one side and the wick is not even visible. Smells great though.
2,2019-04-12,Barely any scent. Would not buy again.
1,2022-05-11,The candle was delivered melted
1,2022-06-05,Came smashed and broken. Annoyed.
4,2013-09-03,Never had this candle scent before and it is really nice.  The aroma just taking the lid off is strong and I love the color.  It fits in great in the room I am using it.  Thanks Amazon!
1,2020-12-12,"Not a nice smell...I can't tell what it's supposed to smell like, but whatever it is isn't very pleasant... it's kind of bitter smelling. That being said, you really can't go wrong with Yankee Candles. They're great smelling (usually) and burn for a very long time. You definitely get more bang for the buck. Nice for gifting!"
2,2020-01-06,Not the best scent
1,2018-12-03,"I keep hearing how great Yankee candles are. I've tried several and am always disappointed. Someone suggested I try this scent and I wouldn't be disappointed. Wrong. The candles do not burn evenly, and the wick is not strong, so a waste of wax. I'm sticking to Shorties candles. Best I've found so far."
1,2021-02-05,This candle is so pretty and I reorderedBut it has no smell as I realized nowWhich is the purpose of a Yankee candle ..!
4,2020-04-09,Broken glass everywhere!!!
1,2021-10-15,"I love the smell of this candle. Not all did it take a week to arrive, but  the candle came shattered."
1,2022-08-04,Candle had no scent
2,2022-02-28,I enjoyed the scent but it’s a completely different than the one I decided to purchase.
1,2021-07-29,No smell darn!
2,2022-06-04,You can barely smell anything. Not worth the money.
2,2020-08-19,Little to no scent.
1,2020-11-11,"The candle didn’t burn properly. It created a large black smoke that stained my wall and no matter what, it failed to go away. I had to throw the whole thing away. As expensive as these are. What a waste."
2,2019-06-23,Does NOT stay lit.
1,2018-06-29,Don’t like the smell. If you want a good smelling Jasmine candle try Golden Jasmine from Bath&Body. Also came very melted and I had to use a torch to find the wick. That’s my fault for ordering in summer I guess.
3,2020-02-02,Candle smells great however it was shattered and in a million pieces. Wouldn’t even want to send back cause I would be afraid someone would cut themself 😢
2,2020-07-28,Scent is not strong AT ALLBurns extremely fastCheaply produces wickNot worth the money
2,2020-07-25,The smell is amazing but when this candle arrived its was melted this way. Other candles that I had in the particular order were not affected besides this one. I'm not sure what to do with this haha.
2,2020-07-27,Glass jar broken... I will try to melt it and transfer into another jar. Smells lovely.
1,2020-11-17,I love Yankee candles when you can actually smell the scent of them.  The candle we are burning now we can't smell at all!  I think this was a replacement candle for another candle we got which melted all over the box or another one that arrived with a broken glass around the candle.  These are expensive candles so they definitely should have a scent to them.
2,2022-07-22,"Smells great, arrived broken"
5,2014-07-12,I love Yankee Candles!!! But this one is now my favorite.  It leaves your room smelling like its filled with fresh cut roses.
2,2020-11-03,Definitely expected more out of a brand like this. It’s the equivalent of a standard unscented candle that you can find at the local market for $1
1,2022-05-02,"I do not know who is at fault, but when I opened the package the candle jar was broken"
3,2017-07-21,fragrance too weak
1,2022-01-03,"This is the first bad experience with a Yankee candle and I use them for over 20 years. When burning, the candle produced a heavy black smoke; so bad that the white fur on my white Bichon Maltese became gray. This candle shows it was made in Czech Republic so I wonder if the quality is different than the ones made in US."
2,2019-05-10,Not as nice as the review I read.
3,2017-09-01,Scent is very faint.
1,2022-04-22,Bothered my allergies.
1,2021-03-29,My daughter has purchased this candle in the past and has enjoyed it however when I ordered the exact same product when it arrived there was no wick. We even took a metal spoon and attempted to dig a little to see if the wick had just been buried in the wax and we were not able to find the wick. Very disappointed does not even begin to cover how I feel right now
1,2020-12-20,Looks like someone either put a sun and sand label on another jar. Or someone poured another candle into a sun and sand jar. Disrespectful!
1,2021-08-06,"Smells very floral. If you like floral scents you will love this candle. I do not like floral scents and I don’t think a walk on the beach should smell anything like flowers. When I think of floral scents, I think of grandmas house. I love my grandma but I don’t want my house to smell like her."
1,2021-12-03,I have been buying this candles for decades! Yankees products got changed. They don’t have that smell anymore. The candle doesn’t even smell at all.They lost their quality
4,2015-09-18,I LIKE IT
1,2020-10-28,Unable to use candle because it was damaged upon arrival.  Tried but candle would not light
3,2020-04-26,This candle han scent my wife is displeased
1,2020-07-04,Do not buy Yankee candles from amazon. There is no dicount. This candle has no color and no scent and a faded picture on the front of the candle. It was very old. Buy from Yankee you can get some good deals. The scent was sold out. It is my favorite. Now nothing but wasted money!
1,2022-05-12,No smell at all
3,2016-06-06,Candle did not burn evenly leaving to much of the candle left in the jar.
1,2021-10-26,"As pictured, the wax was somehow completely up inside the lid. The entire side of the jar is empty. Can’t see a wick. I don’t even understand how this was sent out."
1,2021-04-19,"It does last well. However, we all found the smell overwhelming. Lilacs on steroids! Would not recommend."
2,2020-05-23,This did not smell like gardenia at all. It just smells like floral and perfume. Disappointed.
4,2015-09-18,FAIR DEAL
1,2021-01-06,There’s no noticeable scent to this burning candle unless all the soot that’s in my nasal cavity (from burning this candle) is preventing me from actually being able to detect any scent. Can’t imagine what’s settling in my lungs and I live in Los Angeles. Before you ask I Definitely don’t have COVID.
1,2021-08-17,Disappointed the lilac scent was not there. Just a purple non scented one
2,2019-01-13,"The sent smells like chemicals. It makes me cough and my nose run, despite I’ve never had this reaction with other candles. No problems with the shipping or packaging."
3,2020-09-21,I expected it to be more fragrant.
3,2020-02-29,"I have been wanting this flavor for awhile. Sweet scent, kinda a seeet berry smell. Would definitely gift it."
1,2021-08-06,The media could not be loaded.
3,2020-02-01,Candle smells so good but the top of the candles glass was broken. Obviously still useable but need to work on better packaging.
4,2013-03-27,"It has long life, burns evenly.Smells terrific, however the scent is very strong, it may not be good for a small room."
3,2016-11-26,"Long lasting, but very subtle aroma."
2,2022-03-22,Scent too strong
5,2015-01-27,Mmmmm
3,2016-03-26,Not a powerful scent. Tyler candles are better.
3,2016-06-07,"better to buy these at walmart.. product good, price was too high"
2,2016-04-14,"Smelled great, but the idea of soot in the house was a turn-off. I returned these and bought soy based candles instead!"
1,2022-07-07,Terrible artificial aroma.
1,2021-11-18,"Product glass jar was shattered on arrival. Box was fine.  Attempted to use return/replace on Amazon site indicating the box was fine but the product was damaged. Each attempt resulted in being stuck in a loop. I’m unable to get a replacement which I would prefer, or a refund. Extremely dissatisfied."
1,2021-07-24,I have been buying scented candles from Yankee candle for 10 years now and they always lasted nearly a month. This one lasted barely 4 days and had no scent to it at all. Not at all worth what I paid for it.
3,2018-12-12,"Not a strong smell, which I like"
1,2022-05-16,No wick.  Can’t burn
1,2021-12-14,"Waste of money, in my opinion. Can not smell the candle at all. Very disappointed."
1,2020-02-17,This came to me shattered in tiny pieces with glass shards falling out of the box. I’m trying to figure out how to take this box to Kohl’s for return without getting glass everywhere.
3,2020-09-30,"Missing from 1st delivery, Broken in second..."
2,2015-06-01,"Weak scent.  Given what I paid for this, it expected a more noticeable scent.  Unless I am close enough to feel the flame's heat, I'm not smelling anything."
1,2022-07-22,"What did I buy this for ? In case power goes out at night?This thing has absolutely no scent, and I dont have or ever had Covid."
3,2018-04-06,"Loved the aroma at fist, the more I used it the less it seems to have any aroma at all."
1,2022-03-06,"It came completely defective and the wax settled to one side, it’s un usable - smelled good but I feel like an idiot for purchasing - wondering if I could get a new one but what a dissapointment"
1,2022-05-09,"Not giftable… looks like a candle I could’ve gotten at the Dollar Store since there was zero labels or sticker label on it, as shown. Very disappointed since this isn’t a cheap candle and it doesn’t even say Yankee Candle on it."
3,2021-04-18,The scent is too strong
2,2015-05-03,all I can smell is the candle wax had a friend over and that's she could smell also. could done the same at walmarts $5.00 a jar candles
1,2020-09-04,MY Beach walk candle Picture says it all 🤦🏾‍♀️very dissatisfied with the way it arrived I will be resending this back I do love how it came super fast after ordering it salted caramel seems a bit rushed in making it as well 🤦🏾‍♀️
2,2017-12-08,Candle was stored up side down. Melted up side down. Not usuable. Scent was weak as well.
1,2020-06-25,First delivery broken. Glass everywhere.  This one insanely melted and unuseable. I just opened it...too late to get a refund. What a rip off!!
3,2019-12-15,I purchase these candles as Christmas gifts. But 2 of the 4 candles I received came broken. I am very disappointed at this point!!!!
2,2019-12-08,Arrived in broken pieces
2,2020-07-17,So I had bought this little gift for my GF because she loves Lilacs and well since it came in broken the top is broken and the glass is cracked so I don't know if I can even light this.
2,2014-10-30,"Transplanted to Texas 30 years ago, but I still remember the amazing scent.  I miss lilacs terribly.This didn't fill the hole."
1,2020-05-02,"Opened the box only to find glass shattered and the entire top half of the glass encasing broken.... The box doesn't look damaged or shoe signs of being dropped, however the mold that this candle was in shows it was clearly broken from being dropped. Going to have to find a way to light this thing with some kind of glass jar that can hold it."
1,2020-07-27,"Wish i could give a real review about the smell and longevity of this candle but unfortunately mine came in broken. All i can said is that it does smells good, right when i opened the box i could smelled already. Now im returning this one and waiting for a replacement. I will update my review then."
1,2020-05-19,I LOVE yankee candles especially The Pink sands scent BUT unfortunately both of the candles I bought here gave off ZERO scent.Very disappointed
2,2021-07-08,It has no smell
4,2019-02-08,The size is nice to keep using long but smell is like watermelon
1,2022-02-13,So very disappointing. This candle did not even have a scent when I opened the jar. Waste of money. I used to love Yankee candles. The last two I purchased were very poor quality. Fool me once shame on you....fool me twice shame on me.
2,2018-01-13,Barely any fragrance at all. Wish I could return them.
1,2020-06-09,"This candle arrived late, AND was leaking all over its cardboard packaging. It turned into liquid and I can’t even fish out the wick if I wanted to without mangling the whole thing. It’s an end of the year teacher gift, too, so I’m not too thrilled right now."
1,2019-10-05,This doesn't smell like the beach at all. Unless your idea of the beach smells like an old lady's bathroom 😂. Can't believe I fell for this crap. Smells like Jean Natae perfume. Terrible.
4,2018-10-25,Simply amazing candle
3,2018-08-04,It was melted upon arrival. Thier scents have gotten weaker. I am going to try soy based candles.
3,2014-08-21,Love Yankee candles to have on hand for a quick gift I might have forgot about or just to put out in my own home. However this is one item you can ALWAYS get considerably cheaper in store or on their website!
4,2018-02-11,"Scent is nice, but not very noticeable."
1,2022-07-12,Product was not on my port h for more than 2 minutes it was completely melted unusable
3,2017-02-23,Wonderful!
2,2018-06-17,Nice sent but not a strong scent....
2,2021-06-15,"This candle does not have a strong aroma, would not recommend"
1,2022-07-01,"There's only little fragrance, the same as what you buy in dollar store $3.99. what a waste of money."
1,2021-11-25,"Needed a candle of a specific diameter for holder, this said it was the right size but when it came is was 1/2 inch smaller diameter, disappointed."
1,2022-01-16,Not what I was looking for.
3,2020-09-06,Does not give a strong enough aroma for me.
1,2021-01-13,"It barely has any scent! Since I have used it, I am not sure if I can still return it. Very disappointed."
1,2022-02-25,
3,2016-12-07,Glass shattered
3,2016-08-15,Candle was leaking
1,2022-05-08,"Candle was supposed to be a Mother’s Day gift but it arrived melted into the lid, and warped to the point that the wick couldn’t be detected nor the lid able to come off (wax melted into lid….). Very disappointed"
1,2019-11-09,It came completely melted sideways! Awful. I will never order again because now I have to go through the hassle of returning it. It’s not allowing me to post a pic of this mess.
1,2022-01-29,Not the best!
3,2016-06-07,great scent but prices better at walmart
1,2020-04-18,"This candle's scent is wonderful, however, the jar was broken in transit and I need to ?return? it for a refund???!!!  Really??!!  Why would they want it back just to throw it away?"
2,2022-03-30,Arrived completely broken 😣
1,2021-02-12,I ordered 2 Lilac candles the boxes both say Lilac on them. I opened them and they are both Pink Sands. I was very disappointed. Lilac was what I purchased and it my all time favorite scent. This is the first time this has ever happened to me.
2,2018-06-06,Did not like the smell.
1,2020-12-06,Budget option for candle lovers. Disappointed with the smells . Not smelling as advertised.
1,2020-03-30,"This was a waste of purchase if you like jasmine scent. You can smell the jasmine if you are just smelling the wax, but when you burn it there is no jasmine scent, not even a subtle hint of it. I lit it in a small room with door closed and it didn't even smell like jasmine or like anything else. Very disappointed."
4,2015-09-04,Good quality! One of my favorite scents.
1,2013-05-08,"Nice candle...sent to my daughter ....TOO BAD THE THOUGHTFUL CARD WAS ADDRESSED TO A TOTALLY DIFFERENT PERSON FOR A DIFFERENT HOLIDAY...HOPE AUNT AMY (?).. ISNT TOO DISAPPOINTED,"
3,2014-10-26,sad to say but the quality isn't what it used to be. I'm no longer a fan.
1,2020-07-26,"This is second broken (glass) candle I have received. There is no found method to request another replacement, or, money back."
1,2021-01-03,This candle smells like absolutely positively NOTHING! I will definitely not purchase this again.
3,2014-12-11,Nice scent and candle but a little expensive.
1,2018-12-26,I got the wrong candle.. instead of bothering with a return I just gave it to someone for a Christmas present. Kind of disappointed I was really looking forward to the pink sands.
1,2022-01-06,Looks melted on top I got 2 one is ok but this one no good
2,2021-08-25,"Scent was great at first, but it lost scent right away"
1,2021-03-14,Scent is nothing. Just my room. Finally splurged and I'm sorry!!!!!
2,2018-02-20,Doesn't smell like much.
1,2021-03-07,I thinks I got a bad jar because my had no scent like it did before.
1,2012-12-12,"Candle was the right one, but the jar was broken.  They need to do a much better job packaging them, and use tape to hold the plastic around the product."
1,2021-11-14,"came with a mold on it!!! wtf?!?!! on 4 different candles!If i'm burning the candle while having mold on it, It means I need to breath itThis is so upsetting!! I will ask for a refund but for now I would'nt recommend buing for sure!"
1,2020-06-06,The candle arrived with shattered glass. They did replace it for me. The second one came with the wax all lopsided to one side. I can’t even light it.
2,2019-12-26,"They are ok.they just do not have a Long burn time. They also are not as big as they appear ,so beware!!😒"
2,2018-01-15,Smells funny. Don't like it
1,2021-10-02,Never buy this one again.  It does not last and it’s not a great scent
1,2020-09-22,"Scent not noticeable, possible old ? Very unhappy, Yankee candles are usually fragrant, this is not!"
4,2019-02-02,I will definitely buy this again!!
3,2021-01-31,Can barely smell the scent
3,2019-03-23,Minimal scent
2,2017-09-18,Very little smell to it- burning or not
1,2020-05-18,"HORRIBLE JUST HORRIBLE! GARBAGE I BOUGHT 3 YANKEE CANDLES ALL 3 HAVE NO SCENT.  WEDDING DAY,  BEACH WALK AND SUN AND SAND."
2,2017-08-10,I must have gotten one out of the BAD batch. I barely smell this one.
1,2020-07-26,"Well, the first one was melted with no wick in sight.The replacement was broke upon arrival.I’ll go to the store and buy one."
2,2017-06-19,it came broken three candles
1,2021-05-02,Try village candles instead betterThe black smoke is ridiculous but village candles burn clean
5,2014-10-28,A gift for my brother in law it reminds him of home :)
1,2021-02-22,"Burns fat, VERY faint scent unlike when you buy from Yankee Candle"
3,2015-05-21,Not too much fragrance!
1,2020-07-08,2 separate orders and both broken.  The smell is amazing though but I must have received a batch that was damaged.
2,2020-12-16,Poor smell
1,2022-01-03,I was glad it came in 2 days early but now that I c it’s broke I lost all excitement. This usually happens whenever I buy cheap candles but I would’ve never expected this from yankee candle. I’m done.
1,2022-01-05,
2,2020-07-19,Glass jar arrived broken.
2,2020-05-04,Does not have a scent..might be an old candle. I would recommend buying from a store instead.
2,2019-03-30,Use it in my bedroom but no smell.
2,2020-05-28,No wick visible.
3,2015-11-02,Nice aroma.
4,2018-03-14,My candle was  broken when  it arrived the jar wasTotally damage
1,2020-09-02,This candle came in a Yankee Candle box but it wasn't a Yankee Candle.  It's an Aromascape Lavender Vanilla.  It's scent is weak and it burns unevenly.
4,2017-01-04,gift
2,2021-01-15,There was no scent in this candle
3,2018-03-27,I love Yankee but I did not care for this scent at all.
1,2020-06-05,I have purchased pinks sand from the actual Yankee store and it is an amazing candle. But the candle that I purchased on amazon has absolutely no scent.
